{
  "ruleset_id": "EU-AI-ACT-2026",
  "name": "EU AI Act Compliance Ruleset",
  "version": "1.0.0",
  "effective_date": "2026-08-02",
  "jurisdiction": "EU",
  "source_url": "https://artificialintelligenceact.eu/",
  "description": "Regulatory rules derived from Regulation (EU) 2024/1689 (the EU AI Act). Covers prohibited practices, high-risk requirements, transparency obligations, and GPAI obligations. Rules sourced from official EU texts and the EU AI Office.",
  "rules": [
    {
      "id": "EUAI-RISK-001",
      "article": "Article 9",
      "category": "risk_management",
      "title": "Risk management system",
      "description": "A risk management system shall be established, implemented, documented and maintained for high-risk AI systems. It shall consist of a continuous iterative process run throughout the entire lifecycle.",
      "applies_to": ["high_risk"],
      "severity": "critical",
      "weight": 10,
      "source": "https://artificialintelligenceact.eu/article/9/",
      "effective_date": "2026-08-02",
      "evidence_guidance": "Provide risk assessment documentation, risk register, mitigation plans, and evidence of periodic review."
    },
    {
      "id": "EUAI-RISK-002",
      "article": "Article 9",
      "category": "risk_management",
      "title": "Known and foreseeable risks identification",
      "description": "Identify the known and foreseeable risks the high-risk AI system can pose to health, safety or fundamental rights when used in accordance with its intended purpose.",
      "applies_to": ["high_risk"],
      "severity": "critical",
      "weight": 8,
      "source": "https://artificialintelligenceact.eu/article/9/",
      "effective_date": "2026-08-02",
      "evidence_guidance": "Provide a documented risk inventory with impact assessments for each identified risk."
    },
    {
      "id": "EUAI-RISK-003",
      "article": "Article 9",
      "category": "risk_management",
      "title": "Foreseeable misuse analysis",
      "description": "The risk management system must consider reasonably foreseeable misuse of the AI system.",
      "applies_to": ["high_risk"],
      "severity": "high",
      "weight": 6,
      "source": "https://artificialintelligenceact.eu/article/9/",
      "effective_date": "2026-08-02",
      "evidence_guidance": "Provide misuse scenario analysis and mitigation strategies."
    },
    {
      "id": "EUAI-RISK-004",
      "article": "Article 9",
      "category": "risk_management",
      "title": "Risk mitigation measures",
      "description": "Adopt appropriate and targeted risk management measures to address identified risks.",
      "applies_to": ["high_risk"],
      "severity": "critical",
      "weight": 8,
      "source": "https://artificialintelligenceact.eu/article/9/",
      "effective_date": "2026-08-02",
      "evidence_guidance": "Show implemented mitigation controls for each identified risk."
    },
    {
      "id": "EUAI-RISK-005",
      "article": "Article 9",
      "category": "risk_management",
      "title": "Residual risk assessment",
      "description": "Assess whether residual risks remain acceptable after mitigation, with testing evidence.",
      "applies_to": ["high_risk"],
      "severity": "high",
      "weight": 6,
      "source": "https://artificialintelligenceact.eu/article/9/",
      "effective_date": "2026-08-02",
      "evidence_guidance": "Document residual risk levels and justification for acceptability."
    },
    {
      "id": "EUAI-DATA-001",
      "article": "Article 10",
      "category": "data_governance",
      "title": "Data governance for training, validation and testing",
      "description": "Training, validation and testing datasets shall be subject to data governance practices appropriate for the intended purpose.",
      "applies_to": ["high_risk"],
      "severity": "critical",
      "weight": 10,
      "source": "https://artificialintelligenceact.eu/article/10/",
      "effective_date": "2026-08-02",
      "evidence_guidance": "Dataset documentation, provenance records, collection methodology."
    },
    {
      "id": "EUAI-DATA-002",
      "article": "Article 10",
      "category": "data_governance",
      "title": "Dataset relevance and representativeness",
      "description": "Datasets shall be relevant, sufficiently representative, and to the best extent possible free of errors and complete.",
      "applies_to": ["high_risk"],
      "severity": "high",
      "weight": 8,
      "source": "https://artificialintelligenceact.eu/article/10/",
      "effective_date": "2026-08-02",
      "evidence_guidance": "Dataset statistics, distribution analysis, representativeness assessment."
    },
    {
      "id": "EUAI-DATA-003",
      "article": "Article 10",
      "category": "data_governance",
      "title": "Examination for biases",
      "description": "Datasets shall be examined for possible biases likely to affect health and safety, negatively impact fundamental rights, or lead to discrimination.",
      "applies_to": ["high_risk"],
      "severity": "critical",
      "weight": 8,
      "source": "https://artificialintelligenceact.eu/article/10/",
      "effective_date": "2026-08-02",
      "evidence_guidance": "Bias testing results, fairness metrics, remediation actions."
    },
    {
      "id": "EUAI-DATA-004",
      "article": "Article 10",
      "category": "data_governance",
      "title": "Data provenance and lineage",
      "description": "Document the provenance of datasets used, including collection methods, origin, and processing history.",
      "applies_to": ["high_risk"],
      "severity": "medium",
      "weight": 5,
      "source": "https://artificialintelligenceact.eu/article/10/",
      "effective_date": "2026-08-02",
      "evidence_guidance": "Data lineage records, collection purpose documentation."
    },
    {
      "id": "EUAI-DATA-005",
      "article": "Article 10",
      "category": "data_governance",
      "title": "Data minimisation and purpose limitation",
      "description": "Data collection should be adequate, relevant, and limited to what is necessary for the intended purpose.",
      "applies_to": ["high_risk"],
      "severity": "medium",
      "weight": 5,
      "source": "https://artificialintelligenceact.eu/article/10/",
      "effective_date": "2026-08-02",
      "evidence_guidance": "Document data minimisation measures, retention policies."
    },
    {
      "id": "EUAI-TECH-001",
      "article": "Article 11",
      "category": "technical_documentation",
      "title": "Technical documentation",
      "description": "Draw up technical documentation before the system is placed on the market or put into service, kept up-to-date.",
      "applies_to": ["high_risk"],
      "severity": "critical",
      "weight": 10,
      "source": "https://artificialintelligenceact.eu/article/11/",
      "effective_date": "2026-08-02",
      "evidence_guidance": "Complete technical documentation per Annex IV requirements."
    },
    {
      "id": "EUAI-TECH-002",
      "article": "Article 11 / Annex IV",
      "category": "technical_documentation",
      "title": "System purpose and intended use",
      "description": "Document the intended purpose, the provider, and the version of the AI system.",
      "applies_to": ["high_risk"],
      "severity": "critical",
      "weight": 6,
      "source": "https://artificialintelligenceact.eu/article/11/",
      "effective_date": "2026-08-02",
      "evidence_guidance": "Clear statement of intended purpose, version history, provider details."
    },
    {
      "id": "EUAI-TECH-003",
      "article": "Article 11 / Annex IV",
      "category": "technical_documentation",
      "title": "Architecture and design description",
      "description": "Describe the system architecture, design specifications, and algorithms.",
      "applies_to": ["high_risk"],
      "severity": "high",
      "weight": 6,
      "source": "https://artificialintelligenceact.eu/article/11/",
      "effective_date": "2026-08-02",
      "evidence_guidance": "Architecture diagrams, component descriptions, model/provider details."
    },
    {
      "id": "EUAI-TECH-004",
      "article": "Article 11 / Annex IV",
      "category": "technical_documentation",
      "title": "System limitations and known risks",
      "description": "Document the known limitations, known risks, and foreseeable unintended outcomes.",
      "applies_to": ["high_risk"],
      "severity": "high",
      "weight": 6,
      "source": "https://artificialintelligenceact.eu/article/11/",
      "effective_date": "2026-08-02",
      "evidence_guidance": "Limitations register, risk catalogue."
    },
    {
      "id": "EUAI-LOG-001",
      "article": "Article 12",
      "category": "logging_traceability",
      "title": "Record-keeping (logging)",
      "description": "High-risk AI systems shall enable the automatic recording of events (logs) over the system's lifetime.",
      "applies_to": ["high_risk"],
      "severity": "critical",
      "weight": 10,
      "source": "https://artificialintelligenceact.eu/article/12/",
      "effective_date": "2026-08-02",
      "evidence_guidance": "Logging implementation, log schema, retention configuration."
    },
    {
      "id": "EUAI-LOG-002",
      "article": "Article 12",
      "category": "logging_traceability",
      "title": "Input/output traceability",
      "description": "Logs shall record the inputs and outputs of the AI system, enabling traceability of decisions.",
      "applies_to": ["high_risk"],
      "severity": "critical",
      "weight": 8,
      "source": "https://artificialintelligenceact.eu/article/12/",
      "effective_date": "2026-08-02",
      "evidence_guidance": "Evidence of input/output logging with timestamps."
    },
    {
      "id": "EUAI-LOG-003",
      "article": "Article 19",
      "category": "logging_traceability",
      "title": "Automatically generated logs",